{
  "schema_version": 1,
  "batch_id": "bbbbbbbb-bbbb-4bbb-8bbb-bbbbbbbbbbbb",
  "user_id": "demo-user-1",
  "device_id": "demo-iphone-1",
  "sent_at": "2026-07-18T14:32:07Z",
  "capabilities": [
    {
      "schema_version": 1,
      "capability_id": "c1111111-1111-4111-8111-111111111111",
      "user_id": "demo-user-1",
      "metric_type": "heart_rate",
      "acquisition_class": "live",
      "status": "available",
      "checked_at": "2026-07-18T14:32:06Z",
      "source": "apple_live_workout",
      "source_kind": "apple_live_workout",
      "source_name": "Demo Apple Watch",
      "source_bundle_id": "com.example.vitalrelay",
      "device_model": "Apple Watch",
      "simulated": false,
      "error_code": null,
      "used_for_escalation": false
    },
    {
      "schema_version": 1,
      "capability_id": "c2222222-2222-4222-8222-222222222222",
      "user_id": "demo-user-1",
      "metric_type": "respiratory_rate",
      "acquisition_class": "recent_context",
      "status": "available",
      "checked_at": "2026-07-18T14:32:06Z",
      "source": "apple_healthkit",
      "source_kind": "apple_healthkit",
      "source_name": "Demo Apple Watch",
      "source_bundle_id": "com.apple.health",
      "device_model": "Apple Watch",
      "simulated": false,
      "error_code": null,
      "used_for_escalation": false
    },
    {
      "schema_version": 1,
      "capability_id": "c3333333-3333-4333-8333-333333333333",
      "user_id": "demo-user-1",
      "metric_type": "oxygen_saturation",
      "acquisition_class": "recent_context",
      "status": "requested_no_sample",
      "checked_at": "2026-07-18T14:32:06Z",
      "source": "apple_healthkit",
      "source_kind": "apple_healthkit",
      "source_name": "Demo Apple Watch",
      "source_bundle_id": "com.apple.health",
      "device_model": "Apple Watch",
      "simulated": false,
      "error_code": null,
      "used_for_escalation": false
    },
    {
      "schema_version": 1,
      "capability_id": "c4444444-4444-4444-8444-444444444444",
      "user_id": "demo-user-1",
      "metric_type": "step_count",
      "acquisition_class": "recent_context",
      "status": "available",
      "checked_at": "2026-07-18T14:32:06Z",
      "source": "replay_pedometer",
      "source_kind": "replay",
      "source_name": "Deterministic demo fixture",
      "source_bundle_id": null,
      "device_model": null,
      "simulated": true,
      "error_code": null,
      "used_for_escalation": false
    },
    {
      "schema_version": 1,
      "capability_id": "c5555555-5555-4555-8555-555555555555",
      "user_id": "demo-user-1",
      "metric_type": "wrist_temperature",
      "acquisition_class": "recent_context",
      "status": "unsupported",
      "checked_at": "2026-07-18T14:32:06Z",
      "source": "apple_healthkit",
      "source_kind": "apple_healthkit",
      "source_name": "Demo Apple Watch",
      "source_bundle_id": "com.apple.health",
      "device_model": "Apple Watch",
      "simulated": false,
      "error_code": null,
      "used_for_escalation": false
    }
  ]
}
